{
  "schema_version": "1.0.0",
  "run_id": "00000000-0000-4000-8000-000000000000",
  "agent": {
    "id": "market_research",
    "name": "Market Research & Insights",
    "version": "1.0.0",
    "model": "claude-opus-5",
    "prompt_sha256": "aaaaaaaaaaaaaaaaaaaaaaaaaaaaaaaaaaaaaaaaaaaaaaaaaaaaaaaaaaaaaaaa"
  },
  "generated_at": "2026-09-14T06:00:00.000Z",
  "input_digest": "0000000000000000000000000000000000000000000000000000000000000000",
  "executive_summary": "Indian manufacturing SMEs face mandatory GST e-invoicing and e-way bill obligations, which creates a recurring compliance workload that software can absorb. Official turnover thresholds and filing mechanics are published by the GST authority and should be confirmed against the current notification before pricing or positioning. Demand concentration in established manufacturing clusters supports a focused four-city entry rather than a national launch.",
  "facts": [
    {
      "id": "F001",
      "statement": "GST registration, return filing and e-invoicing requirements for businesses are published and maintained on the official GST portal.",
      "value": null,
      "unit": null,
      "as_of": "2026-09-14",
      "source_ids": ["S006"],
      "verification": "primary_source_verified"
    },
    {
      "id": "F002",
      "statement": "National accounts and household consumption statistics used for market sizing are published by the Ministry of Statistics and Programme Implementation.",
      "value": null,
      "unit": null,
      "as_of": "2026-09-14",
      "source_ids": ["S011"],
      "verification": "primary_source_verified"
    }
  ],
  "assumptions": [
    {
      "id": "A001",
      "statement": "Roughly 12% of manufacturing SMEs in the four target cities are actively seeking to replace spreadsheet-based GST workflows within 18 months.",
      "rationale": "Derived from observed replacement cycles in adjacent compliance-software categories; no primary survey has been conducted for this segment.",
      "impact_if_wrong": "critical",
      "validation_method": "Run 30 structured discovery interviews across the four cities and measure stated intent plus current tooling."
    },
    {
      "id": "A002",
      "statement": "Finance managers, not owner-operators, are the primary economic buyer in firms above 50 employees.",
      "rationale": "Larger firms typically delegate compliance tooling decisions; unverified for this segment.",
      "impact_if_wrong": "medium",
      "validation_method": "Record the decision-maker role in every sales conversation for the first 40 deals."
    }
  ],
  "estimates": [
    {
      "id": "E001",
      "metric": "serviceable obtainable market year one",
      "low": 900,
      "base": 1800,
      "high": 3200,
      "unit": "paying_firms",
      "method": "bottom_up",
      "depends_on": ["A001"]
    },
    {
      "id": "E002",
      "metric": "average revenue per account per month",
      "low": 1500,
      "base": 2800,
      "high": 4500,
      "unit": "INR",
      "method": "benchmark",
      "depends_on": ["A001", "A002"]
    }
  ],
  "recommendations": [
    {
      "id": "R001",
      "action": "Run 30 discovery interviews across Pune, Ahmedabad, Coimbatore and Delhi-NCR before committing to a pricing tier.",
      "priority": "P0",
      "owner_role": "Founder",
      "effort": "M",
      "rationale_ids": ["A001", "E001"],
      "requires_professional_review": false
    },
    {
      "id": "R002",
      "action": "Confirm current GST e-invoicing turnover thresholds with a chartered accountant before publishing any compliance claim in marketing.",
      "priority": "P0",
      "owner_role": "Founder",
      "effort": "S",
      "rationale_ids": ["F001"],
      "requires_professional_review": true
    }
  ],
  "risks": [
    {
      "id": "K001",
      "description": "Market sizing rests on an unvalidated adoption-intent assumption, so the revenue model may be materially overstated.",
      "category": "market",
      "likelihood": 4,
      "impact": 4,
      "mitigation": "Gate the seed spend on completing discovery interviews and revising E001 before scaling acquisition.",
      "early_warning_indicator": "Fewer than 8 of the first 30 interviews express active replacement intent."
    }
  ],
  "dependencies": [
    { "agent_id": "financial_projections", "relationship": "informs", "note": "E001 and E002 feed the revenue model." },
    { "agent_id": "competitive_landscape", "relationship": "informs" }
  ],
  "sources": [
    {
      "id": "S006",
      "type": "primary_regulator",
      "publisher": "Goods and Services Tax Network",
      "title": "GST registration, returns and rates",
      "url": "https://www.gst.gov.in/",
      "published_at": null,
      "accessed_at": "2026-09-14",
      "retrieval_method": "none"
    },
    {
      "id": "S011",
      "type": "government_statistics",
      "publisher": "Ministry of Statistics and Programme Implementation (MoSPI)",
      "title": "National accounts, consumption and household survey statistics",
      "url": "https://www.mospi.gov.in/",
      "published_at": null,
      "accessed_at": "2026-09-14",
      "retrieval_method": "none"
    }
  ],
  "confidence": {
    "overall": 0.55,
    "basis": "Regulatory mechanics are traceable to primary sources, but all demand sizing rests on an unvalidated adoption assumption.",
    "low_confidence_area_ids": ["A001", "E001"]
  },
  "coverage": {
    "required_sections_present": ["market_overview", "demand_sizing", "segment_definition"],
    "unanswered_questions": [
      "What is the actual willingness to pay among firms under 50 employees?",
      "How many target firms already use an accountant-provided filing service?"
    ]
  }
}
